{
  "schema_version": 1,
  "source_snapshot_sha256": "36b96df5866fddb9736711773b2e02282dc6e526dd072cddbc8c2e59d299e536",
  "issue": {
    "repository": "NVMadhava/onnxruntime",
    "number": 2,
    "url": "https://github.com/NVMadhava/onnxruntime/issues/2",
    "updated_at": "2026-08-06T06:04:01Z"
  },
  "decision": {
    "is_release_candidate": true,
    "source_trust": "demo",
    "lifecycle_status": "released",
    "disposition": "historical",
    "confidence": "medium",
    "reasoning": "The issue content semantically represents an ORT 1.28.0 release-candidate announcement and publishes prerelease packages. Its repository is not the configured authoritative microsoft/onnxruntime source, and the final v1.28.0 release now exists. Materialization therefore requires explicit demo and historical overrides. For the assumed Windows x64 standalone EP host role, Microsoft.ML.OnnxRuntime is the applicable native base runtime package."
  },
  "release": {
    "version": "1.28.0",
    "candidate_revision": "rc.1"
  },
  "evidence": [
    {
      "source_url": "https://github.com/NVMadhava/onnxruntime/issues/2",
      "summary": "The copied body asks users to validate ORT 1.28.0 before release and publishes release-candidate packages."
    },
    {
      "source_url": "https://github.com/NVMadhava/onnxruntime/issues/2",
      "summary": "The body links Microsoft.ML.OnnxRuntime 1.28.0-rc.1 under NuGet CPU packages."
    },
    {
      "source_url": "https://www.nuget.org/packages/Microsoft.ML.OnnxRuntime/1.28.0-rc.1",
      "summary": "NuGet identifies this as a prerelease native package containing native libraries for supported platforms."
    },
    {
      "source_url": "https://github.com/microsoft/onnxruntime/releases/tag/v1.28.0",
      "summary": "The authoritative final v1.28.0 release proves that this copied RC is now historical."
    }
  ],
  "candidate_artifacts": [
    {
      "package": "Microsoft.ML.OnnxRuntime",
      "version": "1.28.0-rc.1",
      "ecosystem": "NuGet",
      "published_url": "https://www.nuget.org/packages/Microsoft.ML.OnnxRuntime/1.28.0-rc.1",
      "download_url": "https://api.nuget.org/v3-flatcontainer/microsoft.ml.onnxruntime/1.28.0-rc.1/microsoft.ml.onnxruntime.1.28.0-rc.1.nupkg",
      "target_os": "Windows",
      "architecture": "x64",
      "role": "Native ORT host runtime and SDK candidate",
      "selection_reason": "Provides the base native runtime needed to load a standalone execution provider.",
      "limitations": [
        "This issue is a demo copy and is not an authoritative upstream announcement.",
        "The target EP repository package-layout contract has not yet been inspected."
      ],
      "evidence_urls": [
        "https://github.com/NVMadhava/onnxruntime/issues/2",
        "https://www.nuget.org/packages/Microsoft.ML.OnnxRuntime/1.28.0-rc.1"
      ]
    },
    {
      "package": "Microsoft.ML.OnnxRuntime.Managed",
      "version": "1.28.0-rc.1",
      "ecosystem": "NuGet",
      "published_url": "https://www.nuget.org/packages/Microsoft.ML.OnnxRuntime.Managed/1.28.0-rc.1",
      "target_os": null,
      "architecture": null,
      "role": "Managed C# bindings",
      "selection_reason": "Not selected because the planned EP ABI validation is native C/C++.",
      "limitations": [],
      "evidence_urls": [
        "https://github.com/NVMadhava/onnxruntime/issues/2"
      ]
    },
    {
      "package": "Microsoft.ML.OnnxRuntime.Gpu.Windows",
      "version": "1.28.0-rc.1",
      "ecosystem": "NuGet",
      "published_url": "https://www.nuget.org/packages/Microsoft.ML.OnnxRuntime.Gpu.Windows/1.28.0-rc.1",
      "target_os": "Windows",
      "architecture": "x64",
      "role": "Native in-tree CUDA and TensorRT provider payload",
      "selection_reason": "Not selected because an external GPU EP does not automatically require bundled in-tree GPU providers.",
      "limitations": [],
      "evidence_urls": [
        "https://github.com/NVMadhava/onnxruntime/issues/2"
      ]
    }
  ],
  "selected_artifacts": [
    {
      "package": "Microsoft.ML.OnnxRuntime",
      "version": "1.28.0-rc.1",
      "ecosystem": "NuGet",
      "published_url": "https://www.nuget.org/packages/Microsoft.ML.OnnxRuntime/1.28.0-rc.1",
      "download_url": "https://api.nuget.org/v3-flatcontainer/microsoft.ml.onnxruntime/1.28.0-rc.1/microsoft.ml.onnxruntime.1.28.0-rc.1.nupkg",
      "target_os": "Windows",
      "architecture": "x64",
      "role": "Native ORT host runtime and SDK candidate",
      "selection_reason": "Provides the base native runtime needed to load a standalone execution provider.",
      "limitations": [
        "This issue is a demo copy and is not an authoritative upstream announcement.",
        "The target EP repository package-layout contract has not yet been inspected."
      ],
      "evidence_urls": [
        "https://github.com/NVMadhava/onnxruntime/issues/2",
        "https://www.nuget.org/packages/Microsoft.ML.OnnxRuntime/1.28.0-rc.1"
      ]
    }
  ],
  "ambiguities": [
    "The copied issue has no original comments, labels, author, timestamps, reactions, or edit history.",
    "The target EP repository is not present, so its exact ONNXRUNTIME_ROOT layout remains unverified."
  ]
}
